id,title,isbn,page_count,publishing_date,form,publisher,language,author,illustrator,originally_published,genres,subject,awards,nominations,characters,description,sub_title
YdW5wSPJXIoC,The Collapse of Complex Societies,"9780521386739, 052138673X",250,1988,Paperback,Cambridge University Press,English,Joseph Tainter,,1988,,"Social Science / Archaeology, Civilization -- Philosophy, Civilization Philosophy, Civilization, Ancient, Comparative civilization, Complex organizations, Regression (Civilization), Civilización antigua, Civilización comparada, Civilization, Filosofía de la civilización, History, Ancient",,,,"Political disintegration is a persistent feature of world history. The Collapse of Complex Societies, though written by an archaeologist, will therefore strike a chord throughout the social sciences. Any explanation of societal collapse carries lessons not just for the study of ancient societies, but for the members of all such societies in both the present and future. Dr. Tainter describes nearly two dozen cases of collapse and reviews more than 2000 years of explanations. He then develops a new and far-reaching theory that accounts for collapse among diverse kinds of societies, evaluating his model and clarifying the processes of disintegration by detailed studies of the Roman, Mayan and Chacoan collapses.",
rd2ibodep7UC,Bowling Alone,"9780743203043, 0743203046",541,2001,Paperback,Simon & Schuster,English,Robert D. Putnam,,2000,,"History / Social History, History / United States / 20th Century, Political Science / Public Policy / General, Social Science / General, Social change -- History -- 20th century -- United States, Social history, United States -- Social conditions -- 1945-",,,,"Once we bowled in leagues, usually after work; but no longer. This seemingly small phenomenon symbolizes a significant social change. Drawing on surveys on Americans' changing behavior over the past twenty-five years, Putnam shows how we have become increasingly disconnected from family, friends, neighbors, and social structures, whether the PTA, church, recreation clubs, political parties, or bowling leagues. Our shrinking access to the ""social capital"" that is the reward of communal activity and community sharing is a serious threat to our civic and personal health. The loss of social capital is felt in critical ways : communities with less social capital have lower educational performance and more teen pregnancy, child suicide, low birth weight, and prenatal mortality. Social capital...",The Collapse and Revival of American Community
fXSODQAAQBAJ,The Collapse of the Common Good,"9780345438713, 034543871X",272,"January 29, 2002",Paperback,Random House Publishing Group,English,Philip K. Howard,,"January 29, 2002",,"Law / Ethics & Professional Responsibility, Philosophy / Ethics & Moral Philosophy, Social Science / Anthropology / Cultural & Social, Bureaucracy -- United States, Citizen suits (Civil procedure) -- United States, Common good, Common sense, Due process of law -- United States, Justice, Administration of -- United States, Law -- United States, Law reform -- United States, Political Science / American Government / General, Political Science / Law Enforcement, Pressure groups -- United States",,,,"In pursuit of fairness at any cost, we have created a society paralyzed by legal fear: Doctors are paranoid and principals powerless. Little league coaches, scared of liability, stop volunteering. Schools and hospitals start to crumble. The common good fades, replaced by a cacophony of people claiming their “individual rights.”

By turns funny and infuriating, this startling book dissects the dogmas of fairness that allow self-interested individuals to bully the rest of society. Philip K. Howard explains how, trying to honor individual rights, we removed the authority needed to maintain a free society. Teachers don’t even have authority to maintain order in the classroom. With no one in charge, the safe course is to avoid any possible risk. Seesaws and diving boards are removed....",How America's Lawsuit Culture Undermines Our Freedom
qZOMswEACAAJ,My Inventions,"9781599869940, 1599869942",86,2006,Paperback,"Filiquarian Publishing, LLC",English,Nikola Tesla,,February 1919,"Autobiography, Biography","Electrical engineers -- Biography -- United States, Inventors -- Biography -- United States",,,,"This important title is the autobiography of Nikola Tesla. Nikola Tesla appropriately titled his work on his life, My Inventions, as he was one of the most important inventors and scientists in history. The book touches on his life and career, his first inventions, discovering the magnetic field, tesla coil and transformer and the manifying transmitter. There is also a chapter on the art of teleautomatics. This book should be read by anybody interested in the life of this important inventor and scientist and his important discoveries which have revolutionized the world.",The Autobiography of Nikola Tesla
h2DTNDFcC14C,Wizard,"9780806519609, 0806519606",542,1998,Paperback,Citadel Press,English,Marc J. Seifer,,1996,,"Electric engineers -- Biography -- United States, Electrical engineers -- Biography -- United States, Inventors -- Biography -- United States, Engineering",,,,"""[Wizard] brings the many complex facets of [Tesla's] personal and technical life together in to a cohesive whole. . .. I highly recommend this biography of a great technologist."" --A.A. Mullin, U.S. Army Space and Strategic Defense Command, COMPUTING REVIEWS

""[Along with A Beautiful Mind] one of the five best biographies written on the brilliantly disturbed."" --WALL STREET JOURNAL

""Wizard is a compelling tale presenting a teeming, vivid world of science, technology, culture and human lives."" --NEW SCIENTIST

""Marc Seifer is an excellent writer and scholar, who has produced a wonderfully readable and illuminating biography of one of the most intriguing men of this century. . . mak[ing] us understand not only the man, but also the times in which he lived. ...",The Life and Times of Nikola Tesla : Biography of a Genius
kFFWipanqsoC,Nikola Tesla,"9780822549208, 0822549204",144,1994,Hardcover,Lerner Publications Company,English,Carol Dommermuth-Costa,,1994,,"Electric engineers -- Biography -- Juvenile literature -- United States, Electrical engineers -- Biography -- Juvenile literature -- United States, Inventors -- Biography -- Juvenile literature -- United States, Technology & Engineering / General, Electrical engineers -- Biography -- United States, Inventors -- Biography -- United States",,,,"These informative and inspiring biographies will give young readers a look at the lives of some of the world's most influential people in history. Each over 100 pages, the books are also ideal for reports.",A Spark of Genius
rwekkS3oD0EC,The Tesla Papers,"9780932813862, 0932813860",100,2000,Paperback,Adventures Unlimited,English,Nikola Tesla,,October 2000,,"Electric engineering -- United States, Electrical engineers -- Biography -- United States, Inventions -- United States, Inventors -- Biography -- United States, Science / History, Science / Research & Methodology, Electric power, Electrical engineering -- History, Electrical engineering -- United States, Electricity",,,,"In the tradition of The Fantastic Adventures of Nikola Tesla, The Anti-Gravity Handbook and The Free Energy Device Handbook, science and UFO author David Hatcher Childress takes us into the incredible world of Nikola Tesla and his amazing inventions. Tesla's rare article, 'The Problem of Increasing Human Energy with Special Reference to the Harnessing of the Sun's Energy' is included. This lengthy article was originally publishing in the June 1900 issue of The Century Illustrated Monthly Magazine and it was the outline for Tesla's master blueprint for the world. Tesla's fantastic vision of the future, including wireless power, anti-gravity, free energy and highly advanced solar power. Also included are some of the papers, patents and material collected on Tesla at the Colorado Spring Te...",
zf0RDAEACAAJ,Boys of Summer,"9780373792689, 0373792689",249,2006,Paperback,Harlequin,English,"Julie Elizabeth Leto, Kimberly Raye, Leslie Kelly",,2006,"Fiction, Romance novel, Contemporary romance","Baseball players -- Fiction, Sports stories",,,,"Baseball. The crack of the bat, the roar of the crowd...and the view of mouthwatering men in tight uniforms A sport in which the men are men...and the women like them that way. Join three of Harlequin Blaze's bestselling authors in celebrating the men who indulge in this All-American pastime -- and the women who help them indulge in other things...

Fever Pitch by Julie Elizabeth Leto
In Fever Pitch, Julie Elizabeth Leto introduces Callie Andrews, a woman who's dying to have one last chance at bat...with her ex-husband

The Sweet Spot by Kimberly Raye
In Kimberly Raye's The Sweet Spot, Babe Bannister discovers that striking out with a sexy shortstop isn't so bad -- especially when it leads to hitting a home run with a delicious coach....

S...",
wX9jQgAACAAJ,Programming Ruby,"9780974514055, 0974514055",830,2005,Paperback,Pragmatic Bookshelf,English,"David Thomas, Chad Fowler, Andrew Hunt",,2001,,"Object-oriented programming (Computer science), Ruby (Computer program language), Object-oriented programming, Ruby, Ruby 1.8",,,,"Ruby is an increasingly popular, fully object-oriented dynamic programming language, hailed by many practitioners as the finest and most useful language available today. When Ruby first burst onto the scene in the Western world, the Pragmatic Programmers were there with the definitive reference manual, Programming Ruby: The Pragmatic Programmer's Guide.



Now in its second edition, author Dave Thomas has expanded the famous Pickaxe book with over 200 pages of new content, covering all the improved language features of Ruby 1.8 and standard library modules. The Pickaxe contains four major sections:
An acclaimed tutorial on using Ruby. The definitive reference to the language. Complete documentation on all built-in classes, modules, and methods Complete descriptio...",The Pragmatic Programmers' Guide
F0MjQEGCLxQC,CliffsNotes on Golding's Lord of the Flies,,101,2000,Paperback,Wiley,English,Maureen Kelly,,2000,,"Literary Criticism / European / English, Irish, Scottish, Welsh, Boys in literature, Survival after airplane accidents, shipwrecks, etc., in literature, Action and adventure films, Airplane crash survival in literature, Boys -- Drama, Castaways -- Drama, Cliffs Notes, English fiction -- Study guides -- Examinations -- 20th century -- History and criticism, Feature films, Films for the hearing impaired, Islands -- Drama, Literature -- History and criticism, Shipwreck survival in literature, Survival -- Drama",,,,"The original CliffsNotes study guides offer expert commentary on major themes, plots, characters, literary devices, and historical background. The latest generation of titles in this series also feature glossaries and visual elements that complement the classic, familiar format.
CliffsNotes on Lord of the Flies takes you on an exploration of William Golding's novel to the dark side of humanity, the savagery that underlies even the most civilized human beings. Follow Golding's group of young boys from hope to disaster and watch as they attempt to survive their uncivilized, unsupervised, and isolated environment.
You can rely on CliffsNotes on Lord of the Flies for character analyses, insightful essays, and chapter-by-chapter commentaries to ensure your safe passage through the ...",
v7q94Nxje8MC,A War Like No Other,"9780812969702, 0812969707",416,"September 12, 2006",Paperback,Random House Publishing Group,English,Victor Davis Hanson,,2005,,"History / Ancient / Greece, History / Civilization, History / Military / General, Greece -- History -- Peloponnesian War, 431-404 B.C.",,,,"One of our most provocative military historians, Victor Davis Hanson has given us painstakingly researched and pathbreaking accounts of wars ranging from classical antiquity to the twenty-first century. Now he juxtaposes an ancient conflict with our most urgent modern concerns to create his most engrossing work to date, A War Like No Other.

Over the course of a generation, the Hellenic city-states of Athens and Sparta fought a bloody conflict that resulted in the collapse of Athens and the end of its golden age. Thucydides wrote the standard history of the Peloponnesian War, which has given readers throughout the ages a vivid and authoritative narrative. But Hanson offers readers something new: a complete chronological account that reflects the political background of the time,...",How the Athenians and Spartans Fought the Peloponnesian War
X_RVAAAACAAJ,We Were Not Like Other People,"9780060255084, 0060255080",216,1989,,Harper & Row,English,Ėfraim Sevela,,1989,,"Jews -- Fiction -- Soviet Union, Jews -- Juvenile fiction -- Soviet Union, World War, 1939-1945 -- Fiction -- Soviet Union, World War, 1939-1945 -- Juvenile fiction -- Soviet Union, Jews -- Fiction -- Russia (Federation), World War, 1939-1945 -- Fiction, Young adult literature",,,,"Separated from his family when the Germans invade Russia during World War II, a young boy learns to fend for himself and earn a living whenever and however he can.",
QealPwAACAAJ,The lovely bones,"9781594130236, 159413023X",532,2004,,Large Print Press,English,Alice Sebold,,2002,"Novel, Psychological Fiction, Domestic Fiction","Domestic fiction, Fiction / Literary, Large type books, more",Indies Choice Book Award for Adult Fiction,,"Susie Salmon, George Harvey, Len Fenerman, Lindsey Salmon, Abigail Salmon, Ray Singh, Buckley Salmon, Mrs. Singh, Samuel Heckler, Hal Heckler, Grandma Lynn, Ruth Connors","Brutally raped and murdered by a deceptively mild-mannered neighbor, Susie begins with a compelling description of her death. During the next ten years, she watches over her family and friends as they struggle to cope with her murder. She observes their disintegrating lives with compassion and occasionally attempts, sometimes successfully, to communicate her love to them. Although the lives of all who knew her well are shaped by her tragic death, eventually her family and friends survive their pain and grief. In [this novel], Susie continues to grow emotionally. She learns that human existence is ""the helplessness of being alive, the dark bright pity of being human feeling as you went, groping in corners and opening your arms to light all of it part of navigating the unknown.""--Library Journal",
VANbAAAAMAAJ,Lovely in Her Bones,"9780345360359, 0345360354",224,"May 13, 1990",Paperback,Random House Publishing Group,English,Sharyn McCrumb,,1985,"Mystery, Fiction","Fiction / Indigenous, Fiction / Mystery & Detective / Amateur Sleuth, Fiction / Mystery & Detective / Women Sleuths, Excavations (Archaeology) -- Fiction, North Carolina -- Fiction, Detective and mystery stories, Forensic anthropology -- Fiction, Indians of North America -- Fiction -- North Carolina, Large type books, MacPherson, Elizabeth (Fictitious character) -- Fiction, Murder -- Fiction, Women anthropologists -- Fiction, Women forensic anthropologists -- Fiction",,,,"""Who but Sharyn McCrumb can make a skull with a bullet hole funny? Those who like sardonic wit, slightly bent characters, and good fun will love Lovely in Her Bones.""—Tony Hillerman

When an Appalachian dig to determine if an obscure Indian tribe in North Carolina can lay legal claim to the land they live on is stopped on account of murder, Elizabeth MacPherson—eager student of the rites of the past and mysteries of the present—starts digging deep. And when she mixes a little modern know-how with some old-fashioned suspicions, Elizabeth comes up with a batch of answers that surprise even the experts. . . .",
6qhhSAAACAAJ,"HTML, XHTML & CSS","9780321430847, 0321430840",456,2007,Paperback,Peachpit Press,English,Elizabeth Castro,,April 2003,,"Cascading style sheets, Electronic publishing, HTML (Document markup language), Hypertext systems, XHTML (Document markup language), Internet, Web sites -- Design, World Wide Web",,,,"Need to learn HTML fast? This best-selling reference's visual format and step-by-step, task-based instructions will have you up and running with HTML in no time. In this completely updated edition of our best-selling guide to HTML, Web expert and best-selling author Elizabeth Castro uses crystal-clear instructions and friendly prose to introduce you to all of today's HTML and XHTML essentials. Yoursquo;ll learn how to design, structure, and format your Web site. You'll create and use images, links, styles, lists, tables, frames, and forms, and you'll add sound and movies to your site. Finally, you will test and debug your site, and publish it to the Web. Along the way, you'll find extensive coverage of CSS techniques, current browsers (Opera, Safari, Firefox), creating pages for the mob...",
z4yLQwAACAAJ,1000 Record Covers,"9783822840856, 3822840858",574,2005,Paperback,Taschen,"French, German",Michael Ochs,,1996,,"Antiques & Collectibles / Records, Art / Techniques / Printmaking, Sound recordings -- Album covers, Art and music, Rock musicians -- Portraits, Sound recordings -- Catalogs -- Album covers",,,,"A fascinating survey of cover art (TASCHEN's 25th anniversary special edition) Record covers are a sign of our life and times. Like the music on the discs, they address such issues as love, life, death, fashion, and rebellion. For music fans the covers are the expression of a period, of a particular time in their lives. Many are works of art and have become as famous as the music they stand for?Andy Warhol's covers, for example, including the banana he designed for The Velvet Underground. This special edition of Record Covers presents a selection of the best 60s to 90s rock album covers from music archivist, disc jockey, journalist, and ex-record publicity executive Michael Ochs's enormous private collection. Both a trip down memory lane and a study in the evolution of cover art, this is a sweeping look at an under-appreciated art form.",
1di6Vv1mtPQC,Killing Yourself to Live,"9780743264464, 0743264460",272,"June 13, 2006",Paperback,Scribner,English,Chuck Klosterman,,"June 28, 2005","Biography, Autobiography","Music / Genres & Styles / Rock, Social Science / General, Social Science / Popular Culture, Biography & Autobiography / Personal Memoirs, Rock music -- Social aspects -- United States, Rock musicians -- Death",,,,"Building on the national bestselling success of Sex, Drugs, and Cocoa Puffs, preeminent pop culture writer Chuck Klosterman unleashes his best book yet—the story of his cross-country tour of sites where rock stars have died and his search for love, excitement, and the meaning of death.

For 6,557 miles, Chuck Klosterman thought about dying. He drove a rental car from New York to Rhode Island to Georgia to Mississippi to Iowa to Minneapolis to Fargo to Seattle, and he chased death and rock ‘n’ roll all the way. Within the span of twenty-one days, Chuck had three relationships end—one by choice, one by chance, and one by exhaustion. He snorted cocaine in a graveyard. He walked a half-mile through a bean field. A man in Dickinson, North Dakota, explained to him why we have fewer wi...",85% of a True Story
MfpvDwAAQBAJ,Vice,"9780553572490, 0553572490",419,"May 2, 1996",Paperback,Random House Publishing Group,English,Jane Feather,,"May 2, 1996","Romance novel, Historical romance, Historical Fiction","Fiction / Romance / Action & Adventure, Fiction / Romance / Historical / Victorian, Fiction / Romance / Suspense, Fiction / Romance / Historical / General, Historical fiction, Love stories, Romance fiction",,,,"From the incomparable Jane Feather, author of national bestsellers Vanity, Violet, and Valentine, comes this enthralling new romance of daring deception and forbidden passion...

Juliana drew the line at becoming a harlot. She had already begun the week as a bride...and ended it as a murderess. She was sure no one would believe that she'd hit her elderly groom with a bed warmer and knocked him dead quite by accident. So she did the only thing she could--she ran. Yet now she was in no
position to turn down a shocking proposition from the dangerously handsome Duke of Redmayne: that she become one man's wife and another man's mistress--his mistress.

Could she play such a role? Could she live up to such a bargain? And once she had tasted the pleasures of Redmayne's bed, would she ever want anything else?",
KMRReyLPyXMC,Zen and the Art of Motorcycle Maintenance,"9780060589462, 0060589469",540,"April 25, 2006",Paperback,HarperCollins,English,Robert M. Pirsig,,1974,"Biography, Autobiography, Philosophical fiction, Travel literature, Autobiographical novel","Philosophy / Eastern, Psychology / Emotions, Psychology / General, Fathers and sons -- United States, Motorcycles -- Maintenance and repair, Philosophy / Zen, Philosophy and civilization, Self, Travel / Essays & Travelogues, United States -- Description and travel -- 20th century, Zen Buddhism and science, Conduct of life, Ego (Psychology), Fathers and sons, Motorcycling, New Age movement, Paperbacks, Values",,National Book Award for Contemporary Affairs,,"THE CLASSIC BOOK THAT HAS INSPIRED MILLIONS
A penetrating examination of how we live and how to live better
Few books transform a generation and then establish themselves as touchstones for the generations that follow. Zen and the Art of Motorcycle Maintenance is one such book. This modern epic of a man's search for meaning became an instant bestseller on publication in 1974, acclaimed as one of the most exciting books in the history of American letters. It continues to inspire millions.
A narration of a summer motorcycle trip undertaken by a father and his son, Zen and the Art of Motorcycle Maintenance becomes a personal and philosophical odyssey into fundamental questions on how to live. The narrator's relationship with his son leads to a powerful self-rec...",An Inquiry Into Values
9-fBHAAACAAJ,Once Upon a Cool Motorcycle Dude,"9780802789471, 0802789471",32,April 2005,Hardcover,Bloomsbury USA,English,,"Carol Heyer, Kevin O'Malley, Scott Goto",2005,"Fairy tale, Fiction, Humor","Juvenile Fiction / General, Juvenile Fiction / Social Themes / General, Authorship -- Juvenile fiction, Fairy tales, Humorous stories, Juvenile Fiction / Humorous Stories, Motorcycles -- Fiction, Motorcyclists -- Juvenile fiction, Princesses -- Fiction, Princesses -- Juvenile fiction, Giants (Folklore) -- Juvenile fiction",,,,"When their teacher gives a joint storytelling assignment, a boy and a girl have different ideas of how their fairy tale should evolve. Can they agree on who will live happily ever after? With a cool motorcycle dude and a beautiful princess the possibilities are endless!

""Hilarious book, perfect for reading aloud."" -Barnes & Noble

Once upon a time there was ... a princess who loved all her beautiful ponies, a cool muscle dude who rode an awesome motorcycle. But a giant came and started stealing them! The dude came to fight the ugly, smelly giant with his mighty sword. She turned gold into thread while she cried for Buttercup, her favorite pony. And he took the princess's gold thread for payment The end!

Wait a minute! That's not how it ends!

Oh no?

Once upon a time there was a boy and a girl who had to tell a fairy tale to the class, but they couldn't agree on the story. Will everyone live happily ever after?",
N-In587uw_EC,Guidebook to Zen and the art of motorcycle maintenance,"9780688060695, 0688060692",407,"November 19, 1990",Paperback,HarperCollins,English,"Ron Di Santo, Tom Steele",,1990,,"Reference / General, Reference / Handbooks & Manuals, Conduct of life, Essentialism (Philosophy), Fathers and sons -- United States, Philosophy / History & Surveys / Modern, Philosophy and civilization, Reference / Personal & Practical Guides, Self, Transportation / Motorcycles / Repair & Maintenance, United States -- Description and travel, Values, Zen Buddhism and science, Ego (Psychology)",,,,"When Robert Pirsig’s Zen and the Art of Motorcycle Maintenance was first published in 1974, it caused a literary sensation. An entire generation was profoundly affected by the story of the narrator, his son, Chris, and their month-long motorcycle odyssey from Minnesota to California. A combination of philosophical speculation and psychological tension, the book is a complex story of relationships, values, madness, and, eventually, enlightenment.
Ron Di Santo and Tom Steele have spent years investigating the background and underlying symbolism of Pirsig’s work. Together, and with the approval of Robert Pirsig, they have written a fascinating reference/companion to the original.
Guidebook to Zen and the Art of Motorcycle Maintenance serves as a metaphorical backpac...",
1aBkQgAACAAJ,Motorcycle Basics Techbook,,222,"July 5, 2002",Paperback,"Haynes Manuals N. America, Incorporated",English,"Matthew Coombs, John Haynes, Pete Shoemark",,,,"Reference / Handbooks & Manuals, Transportation / Motorcycles / Repair & Maintenance, Motorcycles -- Amateurs' manuals -- Maintenance and repair, Motorcycles - Maintenance and repair - Amateurs' manuals",,,,"All common engine, chassis and electrical systems fully explained and illustrated. Topics covered include engine cycles and layouts, carburettors and fuel injection, ignition systems, clutches, gearbox, engine lubrication and cooling, wheels, tires, braking systems, suspension, steering, handling, design and electrical systems.",
