id,title,isbn,page_count,publishing_date,form,publisher,language,author,illustrator,originally_published,genres,subject,awards,nominations,characters,description,sub_title
syuslnDB9OMC,"Fullmetal Alchemist, Vol. 9",,192,"September 19, 2006",Paperback,VIZ Media LLC,English,Hiromu Arakawa,,,,"Comics & Graphic Novels / Manga / Action & Adventure, Comics & Graphic Novels / Manga / Fantasy, Comics & Graphic Novels / Manga / General, Comics & Graphic Novels / Manga / Media Tie-In, Alchemy -- Comic books, strips, etc, Brothers -- Comic books, strips, etc, Fantasy comic books, strips, etc, Graphic novels, Alchemists -- Comic books, strips, etc, Alchemists -- Comic books, strips, etc -- Fiction, Alchemy -- Comic books, strips, etc -- Fiction, Alchemy -- Comic books, strips, etc -- Young adult fiction, Alchemy -- Fiction, Alchemy -- Young adult fiction, Brothers -- Comic books, strips, etc -- Fiction, Brothers -- Comic books, strips, etc -- Young adult fiction, Brothers -- Fiction, Brothers -- Young adult fiction, Cartoons and comics, Comic book, strips, etc -- Translations into English -- Japan, Comic books, strips, etc, Comic books, strips, etc -- Japan, Conspiracies -- Comic books, strips, etc -- Fiction, Deadly sins -- Comic books, strips, etc -- Fiction, Elixir of life -- Comic books, strips, etc, Elixir of life -- Comic books, strips, etc -- Fiction, Fantasy comic books, strips, etc -- Fiction, Fantasy comic books, strips, etc -- Japan, Fantasy comic books, strips, etc -- Young adult fiction, Fathers and sons -- Comic books, strips, etc, Graphic novels -- Japan, Graphic novels -- Translations into English -- Japan, Graphic novels -- Young adult fiction, Graphic novels, Young adult, Manga, Soldiers -- Comic books, strips, etc -- Fiction, Young adult fiction",,,,"Breaking the laws of nature is a serious crime!

In an alchemical ritual gone wrong, Edward Elric lost his arm and his leg, and his brother Alphonse became nothing but a soul in a suit of armor. Equipped with mechanical “auto-mail” limbs, Edward becomes a state alchemist, seeking the one thing that can restore his and his brother’s bodies...the legendary Philosopher’s Stone.

Ed, Al and Winry return to Central Command, but only bad news greets the Fullmetal Alchemist and his friends. Lieutenant Colonel Maes Hughes has been murdered--and Second Lieutenant Maria Ross is the prime suspect! While Maria awaits an uncertain fate in jail, the living suit of armor bearing the soul of serial killer ""Barry the Chopper"" breaks free of the military and goes on a rampage. Now, the my...",
JOZMngEACAAJ,Fullmetal Alchemist,,176,2005,,Viz,English,Hiromu Arakawa,,,,"Alchemy -- Comic books, strips, etc, Alchemy -- Fiction, Alchemy -- Juvenile fiction, Brothers -- Comic books, strips, etc, Brothers -- Juvenile fiction, Comic books, strips, etc -- Japan, Elixir of life -- Comic books, strips, etc, Fantasy comic books, strips, etc, Fathers and sons -- Comic books, strips, etc, Graphic novels, Graphic novels -- Japan, Graphic novels -- Translations into English -- Japan, Military art and science -- Juvenile fiction, Young adult fiction",,,,"As young boys, Edward & Alphonse Elric dabbled in alchemy to try to resurrect their dead mother. As a result, Ed lost one arm and one leg, while Al lost his entire body and had his spirit sealed into a suit of armor. Now, they are searching for the fabled Philosopher's Stone to restore what they've lost.",Volume 3 · Volume 8
nXeMuQAACAAJ,The Last Days of Pompeii,"9781587157394, 158715739X",360,2002,Paperback,"Wildside Press, LLC",English,"Edward Bulwer Lytton, Edward Bulwer Lytton Lytton, Bar",,1834,,Pompeii (Extinct city) -- Fiction,,,,"This is the classic Victorian tale of the last days of Pompeii, the doomed city that lay at the feet of Mount Vesuvius. From poets to flower-girls, gladiators to Roman tribunes, here is a plausible story of their lives, their loves, and the tragic fate that awaited them.",
VlErAQAAIAAJ,Memoirs of a Geisha,,503,1997,Paperback,Vintage Books,English,Arthur Golden,,"September 27, 1997","Novel, Historical Fiction","Fiction / Historical / General, Geishas -- Fiction, Geishas -- Fiction -- Japan, Historical fiction, Japan -- Fiction -- History -- 20th century, Japan -- Fiction -- History -- 20th century -- Social life and customs, Prostitution -- Fiction -- Japan, Women -- Fiction -- Japan, Japan -- Fiction -- History, Japan -- Fiction -- History -- 20th century -- Japan",,,"Chiyo, Hatsumomo, Mameha, Satsu, Pumpkin","The strikingly pretty child of an impoverished fishing family, Chiyo is taken to faraway Kyoto and sold into slavery to a renowned geisha house where she is renamed Sayuri. Initially reluctant, Sayuri must finally invent and cultivate an image of herself as a desirable geisha in order to survive in Gion's cruel hierarchy. Through her eyes, we are given a backstage view of the ancient and secretive geisha district, Gion, and of the lives of the women who learn and practice the rigorous arts of the geisha. Behind its facade of haunting beauty the district turns out to be a viciously competitive place where women vie desperately for men's favor and largess, where a young girl's virginity is auctioned off to the highest bidder, where personal trust is almost nonexistent, and where no woman ...",A Novel
GNw7PgAACAAJ,Memoirs of a geisha,"9780739326220, 0739326228",758,2005,,Random House Large Print,English,Arthur Golden,,"September 27, 1997","Novel, Historical Fiction","Geishas -- Fiction, Historical fiction, Japan -- Fiction -- History -- 20th century, Large print books, Large type books, Women -- Fiction -- Japan, Geishas -- Fiction -- Japan",,,"Chiyo, Hatsumomo, Mameha, Satsu, Pumpkin","In this literary tour de force, novelist Arthur Golden enters a remote and shimmeringly exotic world. For the protagonist of this peerlessly observant first novel is Sayuri, one of Japan's most celebrated geisha, a woman who is both performer and courtesan, slave and goddess.
We follow Sayuri from her childhood in an impoverished fishing village, where in 1929, she is sold to a representative of a geisha house, who is drawn by the child's unusual blue-grey eyes. From there she is taken to Gion, the pleasure district of Kyoto. She is nine years old. In the years that follow, as she works to pay back the price of her purchase, Sayuri will be schooled in music and dance, learn to apply the geisha's elaborate makeup, wear elaborate kimono, and care for a coiffure so fragile that it req...",
XXj94EDmo2oC,Memoirs of a Geisha,"9780099771517, 0099771519",434,1998,Paperback,Vintage,English,Arthur Golden,,"September 27, 1997","Novel, Historical Fiction","Geishas -- Fiction, Geishas -- Fiction -- Japan, Japan -- Fiction -- History -- 20th century, Japan -- History -- Fiction -- 20th century, Geishas -- Fiction -- History -- Japan, Historical fiction, Japan -- Fiction -- Social conditions -- 20th century, Japan -- Social life and customs -- Fiction -- History -- 20th century, Women -- Fiction -- Japan",,,"Chiyo, Hatsumomo, Mameha, Satsu, Pumpkin","Nitta Sayuri tells the story of her life as a geisha. In Memoirs of a Geisha, we enter a world where appearances are paramount; where a girl's virginity is auctioned to the highest bidder; where women are trained to beguile the most powerful men; and where love is scorned as illusion. Sayuri's story begins in a poor fishing village in 1929, when, as a nine-year-old with unusual blue-gray eyes, she is taken from her home and sold into slavery to a renowned geisha house. Through her eyes, we see the decadent heart of Gion - the geisha district of Kyoto - with its marvelous teahouses and theaters, narrow back alleys, ornate temples, and artists' streets. And we witness her transformation as she learns the rigorous arts of the geisha: dance and music; wearing kimono, elaborate makeup and ha...",
i-TjPgAACAAJ,Ángeles y demonios,"9788495618771, 849561877X",508,2005,Hardcover,Umbriel,Spanish,Dan Brown,,May 2000,"Novel, Thriller, Mystery, Suspense, Crime Fiction, Conspiracy fiction","Illuminati -- Fiction, Papacy -- Fiction, Popes -- Fiction -- Election, Secret societies -- Fiction, Spanish language materials, Vatican City -- Fiction",,,"Robert Langdon, Vittoria Vetra, Camerlengo Carlo Ventresca, Leonardo Vetra, Commander Olivetti","El arma más poderosa creada por el hombre, una organización secreta sedienta de venganza... y apenas unas horas para evitar el desastre. La eterna pugna entre ciencia y religión se ha convertido en una guerra muy real. En un laboratorio de máxima seguridad, aparece asesinado un científico con un extraño símbolo grabado a fuego en su pecho. Para el profesor Robert Langdon no hay duda: los Illuminati, los hombres enfrentados a la Iglesia desde los tiempos de Galileo, han regresado. Y esta vez disponen de la más mortífera arma que ha creado la humanidad, un artefacto con el que pueden ganar la batalla final contra su eterno enemigo. Acompañado de una joven científica y un audaz capitán de la Guardia Suiza, Langdon comienza una carrera contra reloj, en una búsqueda desesperada por los rinco...",
kdy9iHwHiU4C,Deception point,"9780552151764, 0552151769",585,2004,Trade paperback,Corgi Books,English,Dan Brown,,2001,"Novel, Thriller, Suspense, Science fiction, Techno-thriller, Political fiction","Conspiracies -- Fiction, Suspense fiction, American, more",,,"Zachary Herney, Senator Thomas Sedgewick Sexton, Rachel Sexton, Corky Marlinson, Norah Mangor, Gabrielle Ashe, Dr. Wailee Ming, William Pickering, Michael Tolland, Xavia","When a new NASA satellite detects evidence of an astonishingly rare object buried deep in the Arctic ice, the floundering space agency proclaims a much-needed victory'a victory that has profound implications for U.S. space policy and the impending presidential election.",
c_276CjPmcUC,A Killing Rain,"9780786016068, 078601606X",383,2005,Paperback,Pinnacle Books,English,P. J. Parrish,,2005,"Fiction, Mystery, Thriller","Everglades (Fla.) -- Fiction, Fiction / Thrillers / General, Kincaid, Louis (Fictitious character) -- Fiction, Murder -- Fiction -- Investigation, Police -- Fiction, Racially mixed people -- Fiction, Serial murders -- Fiction, Paperbacks",,"Shamus Award for Best Original P.I. Paperback, Anthony Award for Best Paperback Original",,"- Specially priced edition of Dark of the Moon ($4.99/$6.99) available January 2005, includes a teaser for A Killing Rain
- Island of Bones was a Featured Alternate Selection of the Mystery Guild and spent two weeks on the USA Today bestseller list, reaching #124.
- Thicker Than Water was a Featured Alternate Selection of the Mystery Guild and spent two weeks on the USA Today bestseller list, debuting at #136.
- Thicker Than Water was nominated for a Shamus and an Anthony Award.
- Paint It Black was a Featured Alternate Selection of the Mystery Guild and spent two weeks on the extended New York Times bestseller list, going as high as #30, and three weeks on the USA Today bestseller list, reaching #79.
- Paint It Black was nominated for an Anthony Award for Best Paper...",
ldpaww5kkmoC,The Millionaire Next Door,"9780671015206, 0671015206",258,October 1998,Paperback,Gallery Books,English,"Thomas J. Stanley, William D. Danko",,1996,,"Biography & Autobiography / Business, Business & Economics / General, Business & Economics / Personal Finance / Investing, Millionaires -- United States, Rich people -- United States, Millionaires, Rich people, Saving and investment -- United States, United States -- Wealth -- Distribution of, Wealth -- United States",,,,"The incredible national bestseller that is changing people's lives -- and increasing their net worth!
CAN YOU SPOT THE MILLIONAIRE NEXT DOOR?
Who are the rich in this country?
What do they do?
Where do they shop?
What do they drive?
How do they invest?
Where did their ancestors come from?
How did they get rich?
Can I ever become one of them?

Get the answers in The Millionaire Next Door, the never-before-told story about wealth in America. You'll be surprised at what you find out....",
HO-cnF0abjgC,Think and Grow Rich,"9781585424337, 1585424331",320,"August 18, 2005",Paperback,Penguin Publishing Group,English,"Napoleon Hill, Arthur R. Pell",,1937,,"Business & Economics / Personal Finance / Money Management, Self-Help / Motivational & Inspirational, Self-Help / Personal Growth / Success, Success in business, Millionaires -- Psychology -- United States",,,,"Think and Grow Rich has been called the ""Granddaddy of All Motivational Literature."" It was the first book to boldly ask, ""What makes a winner?"" The man who asked and listened for the answer, Napoleon Hill, is now counted in the top ranks of the world's winners himself.The most famous of all teachers of success spent ""a fortune and the better part of a lifetime of effort"" to produce the ""Law of Success"" philosophy that forms the basis of his books and that is so powerfully summarized in this one.
In the original Think and Grow Rich, published in 1937, Hill draws on stories of Andrew Carnegie, Thomas Edison, Henry Ford, and other millionaires of his generation to illustrate his principles. In the updated version, Arthur R. Pell, Ph.D., a nationally known author, lecturer, and consult...",The Landmark Bestseller Now Revised and Updated for the 21st Century
wjgNAAAACAAJ,Think and Grow Rich: The 21st-Century Edition,"9781932429237, 1932429239",368,"August 7, 2004",Hardcover,High Roads Media,English,Napoleon Hill,,1937,,"Business & Economics / Entrepreneurship, Success in business",,,,"Napoleon Hill's classic remains to this day the standard against which all other motivational literature is measured. Born into poverty himself, Hill became the protégé of steel baron Andrew Carnegie, who introduced him to the most famous self-made multi-millionaires. They revealed to Hill the secrets they had used to pull themselves out of poverty and create their own success. In every chapter of the original edition Hill cited real-life examples based on this first-hand knowledge. The 21st Century Edition features the complete original text, integrates into each chapter contemporary examples and commentary, correlates the latest management theories with Hill's Principles of Success, and cross-references his Success Consciousness techniques with today's motivational bestsellers, demons...",Revised and Updated
R1Jk-A4R5AYC,1776,"9780743226721, 0743226720",386,"June 27, 2006",ebook,Simon & Schuster,English,David McCullough,,"May 24, 2005",,"Biography & Autobiography / Military, History / United States / General, History / United States / Revolutionary Period (1775-1800), History / Military / United States, Medicine -- History -- 18th century, United States -- History -- Revolution, 1775-1783",Quill Award for History/current events/politics,,,"America’s beloved and distinguished historian presents, in a book of breathtaking excitement, drama, and narrative force, the stirring story of the year of our nation’s birth, 1776, interweaving, on both sides of the Atlantic, the actions and decisions that led Great Britain to undertake a war against her rebellious colonial subjects and that placed America’s survival in the hands of George Washington.

In this masterful book, David McCullough tells the intensely human story of those who marched with General George Washington in the year of the Declaration of Independence—when the whole American cause was riding on their success, without which all hope for independence would have been dashed and the noble ideals of the Declaration would have amounted to little more than words on...",
-dw4AQAAIAAJ,1776,"9780140481396, 0140481397",192,"November 18, 1976",Paperback,Penguin Publishing Group,English,"Sherman Edwards, Peter Stone",,,more,"Drama / American / General, more",,,"Rev. Jonathan Witherspoon, Martha Jefferson, Benjamin Franklin, Stephen Hopkins, Lyman Hall, Thomas Jefferson, Richard Henry Lee, Abigail Adams, John Dickinson, John Witherspoon, John Hancock, Andrew McNair, Edward Rutledge, Lewis Morris, John Adams, Charles Thomson","Winner of five 1969 Tony Awards, including Best Book and Best Musical, this oft-produced musical play is an imaginative re-creation of the events from May 8 to July 4, 1776 in Philadelphia, when the second Continental Congress argued about, voted on, and signed the Declaration of Independence.",A Musical Play
YshbngEACAAJ,The Good Earth (Enriched Classics),"9781416500186, 1416500189",448,"March 29, 2005",Paperback,Simon & Schuster,English,"Pearl S. Buck, Stephanie Reents",,"March 2, 1931","Novel, Historical Fiction","Fiction / Classics, Fiction / General, Married women -- Fiction -- China, China -- Fiction -- History -- Social life and customs",Pulitzer Prize for Fiction,,"Wang Lung, O-Lan, Wang Lung's father, The Poor Fool, Second Baby Girl","ENDURING LITERATURE ILLUMINATED
BY PRACTICAL SCHOLARSHIP
A poignant tale about the life and labors of a Chinese farmer during the sweeping reign of the country¹s last emperor.
EACH ENRICHED CLASSIC EDITION INCLUDES:
• A concise introduction that gives readers important background information
• A chronology of the author's life and work
• A timeline of significant events that provides the book's historical context
• An outline of key themes and plot points to help readers form their own interpretations
• Detailed explanatory notes
• Critical analysis, including contemporary and modern perspectives on the work
• Discussion questions to promote lively classroom and book group interaction
• A list ...",
Z_IO20TJBN8C,Fast Food Nation,"9780060838584, 0060838582",399,"July 5, 2005",Paperback,HarperCollins,English,Eric Schlosser,,"January 17, 2001","Essay, Non-fiction","History / United States / General, Social Science / Sociology / General, Convenience foods -- United States, Fast food restaurants -- United States, Food industry and trade -- United States, SOCIAL SCIENCE / Popular Culture",,,,"Fast food has hastened the malling of our landscape, widened the chasm between rich and poor, fueled an epidemic of obesity, and propelled American cultural imperialism abroad. That's a lengthy list of charges, but Eric Schlosser makes them stick with an artful mix of first-rate reportage, wry wit, and careful reasoning.
Schlosser's myth-shattering survey stretches from California's subdivisions, where the business was born, to the industrial corridor along the New Jersey Turnpike, where many of fast food's flavors are concocted. Along the way, he unearths a trove of fascinating, unsettling truths -- from the unholy alliance between fast food and Hollywood to the seismic changes the industry has wrought in food production, popular culture, and even real estate.",The Dark Side of the All-American Meal
Sbh77-4Xjs4C,Snow Flower and the Secret Fan,"9780812968064, 0812968069",288,"February 21, 2006",Paperback,Random House Publishing Group,English,Lisa See,,2005,"Novel, Historical Fiction, Psychological Fiction, Domestic Fiction","Fiction / Historical / General, Fiction / Literary, Fiction / Psychological, American fiction -- 21st century, Childbirth -- Fiction, China -- Fiction, Domestic fiction, Female friendship -- Fiction, Footbinding -- Fiction, Married women -- Fiction, Nü shu -- Fiction, Older women -- Fiction, Psychological fiction, Reminiscing in old age -- Fiction, Secrecy -- Fiction, Women -- Fiction -- China",,,"Snow Flower's Husband, Snow Flower, Lily's Husband, Lily's aunt, Nina","Lily is haunted by memories–of who she once was, and of a person, long gone, who defined her existence. She has nothing but time now, as she recounts the tale of Snow Flower, and asks the gods for forgiveness.

In nineteenth-century China, when wives and daughters were foot-bound and lived in almost total seclusion, the women in one remote Hunan county developed their own secret code for communication: nu shu (“women’s writing”). Some girls were paired with laotongs, “old sames,” in emotional matches that lasted throughout their lives. They painted letters on fans, embroidered messages on handkerchiefs, and composed stories, thereby reaching out of their isolation to share their hopes, dreams, and accomplishments.

With the arrival of a silk fan on which Snow Flower ha...",A Novel
0zURYumyL-UC,The Power Broker,"9780394720241, 0394720245","1,246","July 12, 1975",Paperback,Knopf Doubleday Publishing Group,English,Robert A. Caro,,1974,,"Biography & Autobiography / Political, History / United States / 20th Century, Political Science / Public Policy / City Planning & Urban Development, Biography & Autobiography / Presidents & Heads of State, New York (N.Y.), New York (N.Y.) -- History -- 1898-1951 -- Politics and government, Public works -- New York (State) -- New York, Social Science / Sociology / Urban, Architects -- Biography -- United States, City planners -- Biography -- United States, City planning -- New York (State) -- New York, New York (N.Y.) -- Biography, New York (N.Y.) -- History, New York (State) -- History -- Politics and government, New York (State) -- Politics and government -- 1951- -- 1865-1950 -- Biography","Francis Parkman Prize, Pulitzer Prize for Biography or Autobiography",National Book Award for Contemporary Affairs,,"PULITZER PRIZE WINNER • A modern American classic, this huge and galvanizing biography of Robert Moses reveals not only the saga of one man’s incredible accumulation of power but the story of his shaping (and mis-shaping) of twentieth-century New York.

One of the Modern Library’s hundred greatest books of the twentieth century, Robert Caro's monumental book makes public what few outsiders knew: that Robert Moses was the single most powerful man of his time in the City and in the State of New York. And in telling the Moses story, Caro both opens up to an unprecedented degree the way in which politics really happens—the way things really get done in America's City Halls and Statehouses—and brings to light a bonanza of vital information about such national figures as Alfred...",Robert Moses and the Fall of New York
FepCmAEACAAJ,The Power Broker,"9780345480606, 0345480600",300,2006,Hardcover,Ballantine Books,English,Stephen W. Frey,,August 2006,"Thriller, Fiction, Suspense","Capitalists and financiers -- Fiction, Corporate culture -- Fiction, Investment bankers -- Fiction, Large type books, New York (N.Y.) -- Fiction, Political campaigns -- Fiction, Presidential candidates -- Fiction, Wall Street (New York, N.Y.) -- Fiction",,,,"Exposing high-level governmental corruption, conspiracy, and murder has garnered plenty of attention for Christian Gillette, the young dynamo chairman of the famous New York private equity firm Everest Capital. Now the reputation he has built taking Everest to the top has been noticed beyond the boardrooms of high finance-by powerful people with potentially devastating agendas.
Christian's own attention is on Las Vegas, where he means to stake out a piece of the action by opening a new casino and launching an NFL franchise. But Sin City didn't get its nickname for nothing, and the mob soon makes it clear that Christian's company will have to pay if it wants to play in the nation's gaming capital. Christian has already taken on corporate pirates and cold-blooded assassins and lived ...",A Novel
rzqENbD0IUgC,Eating for Life,"9780972018418, 0972018417",405,2003,Hardcover,High Point Media,English,Bill Phillips,,"November 24, 2003","Cookbook, Diet book","Cookery, American, Food -- Popular works, Nutrition -- Popular works, Recipes, Cookery, Cooking, Formulas, recipes, etc, Health, Nutrition, Physical fitness -- Nutritional aspects",,,,"Did you truly enjoy the food you ate today? Do you really like the way you look and feel? Are you consistently enjoying great health and high energy?Bill Phillips, author of the #1 New York Times bestseller Body-for-LIFE, believes your answer to all of the above questions should be, ""Yes!"" He feels that food should be a source of pure pleasure. A source of positive, abundant energy! A ""sure thing"" in a world of much uncertainty.Phillips, who's widely regarded as today's most successful fitness author, has firm beliefs which go against the grain of today's popular weight-loss methods. ""Diets, all of them, are potentially dangerous, most always dumb and ultimately a dead-end street!"" he insists. ""Eventually, anyone and everyone who's at all concerned with their health must learn how to fe...",
uKOPrA4Ib9kC,The Warren Buffett CEO,"9780471430452, 0471430455",432,"April 18, 2003",Paperback,Wiley,English,Robert P. Miles,,2002,,"Business & Economics / Personal Finance / General, Law / Banking, Capitalists and financiers -- United States, Chief executive officers -- United States, Finance, Personal, Industrial management -- United States, Investments, Investments -- United States, Management, Management -- United States",,,,"""Everyone knows Warren is the greatest investor of our time. . . .This book for the first time captures his genius as a manager.""
—Jack Welch
The first book to reveal the investment and management strategies of the Berkshire Hathaway all-star management team. Much has been written about Warren Buffett and his investment philosophy; little has been made public about the inside management of Berkshire Hathaway. With a market cap exceeding 100 billion , Berkshire Hathaway has a market value surpassing many icons of American business such as Dell, AT&T, Disney, Ford, Gillette, American Express, and GM. Drawing on his personal experiences as well as those of Berkshire's chief executives, officers, and directors interviewed for this book, Berkshire insider Robert P. Miles provides a unique look at the Berkshire Hathaway culture and its management principles.",Secrets from the Berkshire Hathaway Managers
