id,title,isbn,page_count,publishing_date,form,publisher,language,author,illustrator,originally_published,genres,subject,awards,nominations,characters,description,sub_title
9VIhmAEACAAJ,Ebay for dummies,"9780470045299, 0470045299",386,2007,Paperback,Wiley,English,Marsha Collier,,,,"Business & Economics / E-Commerce / Small Business, Computers / Internet / General, Auctions -- Computer network resources, Internet auctions",,,,"Thinking about buying or selling items on eBay? Whether you want to use eBay to make smart bids and win auctions or turn household clutter into cash, eBay for Dummies, Fifth Edition is your passport to the most successful trading community on the planet. Beginning with an overview of what eBay is and how to become a registered user, eBay for Dummies helps you discover how you can: Search for items to buy and list items to sell on eBay Place a bid—and determine how much you should spend Use pictures and basic HTML to make your eBay listings more appealing Communicate well and close deals without a problem Identify auction terms (reserve price, starting bid, Buy It Now, etc.) Organize your transactions and interactions using the My eBay page Resolve buying and selling issues with eBay’s ...",
XgvYmAEACAAJ,What to Sell on EBay and Where to Get It,"9780072262780, 0072262788",288,"February 14, 2006",Paperback,McGraw-Hill Education,English,"Chris Malta, Lisa Suttora",,2006,,"Business & Economics / Commerce, Business & Economics / Entrepreneurship, Business & Economics / General, Business & Economics / New Business Enterprises, Business & Economics / Purchasing & Buying, Business & Economics / Reference, Business & Economics / Sales & Selling / General, Business & Economics / Small Business, Computers / Internet / General, Computers / Web / General, Internet auctions, Internet marketing, eBay (Firm)",,,,"Sell them exactly what they want to buy
If you want to build a profitable--and consistent--eBay business, you need to start with strategic product sourcing. What to Sell on eBay and Where to Get It reveals the same techniques used by the most successful e-commerce entrepreneurs and by major retail chains to determine what products will sell well and which suppliers will deliver those products for the best price.
Learn to generate product ideas, research your markets, diversify your product line, and build a direct supply of inventory. Using the proven strategies in this book, you’ll be able to find the products that will fuel your business for the long term and skyrocket your sales!
Find out how to spot trends and discover Idea Hotspots Document your product sour...",The Definitive Guide to Product Sourcing for EBay and Beyond
2oFsAAAACAAJ,"Starting an eBay Business for Dummies, Second Edition","9780764569241, 0764569244",408,"September 17, 2004",Paperback,Wiley,English,Marsha Collier,,2002,,"Business & Economics / E-Commerce / General, Computers / Internet / General, Electronic commerce -- Management, Internet auctions, New business enterprises -- Computer networks, Electronic commerce, New business enterprises -- Management",,,,"Want to pick up extra cash? Explore opening an eBay store? Unload your dusty disco albums or the collection of antlers in the basement? Hey, those poor, dead deer could lead to a rich, lively career. Whether you want to build an eBay business from scratch or just want to make sure you’re up on eBay’s policy changes and taking advantage of new automation tools, this guide will have you selling successfully on eBay faster than you can say, “going…going…”Starting an eBay Business For Dummies 2nd Edition gets you organized and in virtual business fast with step-by-step guidance on: Setting up basic auctions Pricing items or setting minimums strategically Using the About Me page to begin creating a professional identity Finding sources of merchandise (once you exhaust your basement, attic, ...",
fkfOAAAACAAJ,EBay,"9780471933823, 0471933821",260,"June 6, 2006",Paperback,Wiley,English,Julia Wilkinson,,2004,,"Computers / Internet / General, Internet auctions, Teleshopping",,,,"You already know eBay basics. Now you'd like to go beyond with shortcuts, tricks, and tips that let you work smarter and faster. And because you learn more easily when someone shows you how, this is the book for you. Inside, you'll find clear, illustrated instructions for 120 tasks that reveal cool secrets, teach timesaving tricks, and explain great tips guaranteed to make your eBay experience more productive.",Top 100 Simplified Tips and Tricks
dX_UngEACAAJ,EBay Timesaving Techniques For Dummies,"9780764559914, 0764559915",391,"June 25, 2004",Paperback,Wiley,English,Marsha Collier,,"June 25, 2004",,"Business & Economics / E-Commerce / Small Business, Computers / Internet / General, Auctions, Auctions -- Computer network resources, Internet auctions, Online purchasing, Teleshopping",,,,"So, you’ve gotten started on eBay. You’ve made a few purchases and your first sale. You may have even built a moneymaking business. Now you’re looking for ways to ratchet things up. You’re looking for the insider tips and tricks for the easiest ways to take care of listing items, completing transactions, and keeping good records and you don't have the time to do all the research. eBay Timesaving Techniques For Dummies is the book for you.
Marsha Collier, an eBay University instructor and best selling author of eBay For Dummies and Starting an eBay Business For Dummies, has collected the fastest and most effective techniques for finding items to sell, setting up your sales pages, pricing items to move, getting the word out about your business, collecting payments, shipping your item,...",
Q6G3NAEACAAJ,EBay Business All-in-One Desk Reference For Dummies,"9780764584381, 0764584383",832,"May 6, 2005",Paperback,Wiley,English,Marsha Collier,,"April 15, 2005",,"Business & Economics / E-Commerce / Small Business, Computers / Internet / General, Internet auctions, Internet marketing, Electronic commerce -- Management",,,,"Bestselling author Marsha Collier presents readers with an all-new guide that goes beyond all previous eBay business books, offering one-stop guidance on eBay techniques as well as entrepreneurial fundamentals. She provides in-depth coverage on the most critical eBay topics, including merchandise sourcing, marketing, advertising, and customer service.
The minibooks that make up the guide cover eBay registration, navigation, and buying; getting ready to sell; digital photography and scanning for sales pages; eBay selling and marketing; getting legal and licensed; using auction management software; setting up an office (PCs, Internet, networking, and shipping); and PayPal.
* Marsha Collier's eBay books have sold hundreds of thousands of copies and her Starting an eBay Business F...",
E_KMa5Zab0MC,Ruby cookbook,"9780596523695, 0596523696",873,"July 19, 2006",Paperback,O'Reilly Media,English,"Lucas Carlson, Leonard Richardson",,2007,,"Computers / General, Computers / Internet / Web Design, Computers / Languages / JavaScript, Computers / Languages / XML, Computers / Programming / General, Computers / Programming / Object Oriented, Computers / Software Development & Engineering / General, Computers / Web / General, Electronic books, Object-oriented programming (Computer science), Ruby (Computer program language)",,,,"Do you want to push Ruby to its limits? The Ruby Cookbook is the most comprehensive problem-solving guide to today's hottest programming language. It gives you hundreds of solutions to real-world problems, with clear explanations and thousands of lines of code you can use in your own projects.
From data structures and algorithms, to integration with cutting-edge technologies, the Ruby Cookbook has something for every programmer. Beginners and advanced Rubyists alike will learn how to program with:
Strings and numbers Arrays and hashes Classes, modules, and namespaces Reflection and metaprogramming XML and HTML processing Ruby on Rails (including Ajax integration) Databases Graphics Internet services like email, SSH, and BitTorrent Web services Multitasking Graph...",
bVf9SQKUumgC,Ruby Ann's Down Home Trailer Park Cookbook,"9780806523491, 0806523492",223,2002,Paperback,Citadel Press,English,Ruby Ann Boxcar,,2002,"Humor, Cookbook","Cooking / Regional & Ethnic / American / Southern States, Humor / Form / Parodies, Cooking, Mobile home living -- Humor",,,,"The success of Ruby Ann's regular newspaper column, Trailer Talk, a fictional but familiar look at the lots of the High Chaparral Trailer Park, led to the publication of this hilarious cookbook, in which each High Chaparral resident has his or her own story to tell, along with juicy gossip, a special photo, and of course, finger lickin' (and cheap) recipes. Features over 200 classic trailer park fixings, from Spam Rolls to Mayonnaise Cake to Homemade Grape Soda, and everything in between, each personally tested by Ruby Ann in the kitchen of her double-wide.",
vyLjg5nCSl4C,Ruby Ann's Down Home Trailer Park BBQin' Cookbook,"9780806525365, 0806525363",206,2003,Paperback,Citadel Press,English,Ruby Ann Boxcar,,2002,"Humor, Cookbook","Cooking / Methods / Barbecue & Grilling, Cooking / Methods / Outdoor, Humor / General, Barbecuing, Outdoor cooking",,,,"b/w photos throughout. The voluptuous gourmet is back tackling the grill with her famous good humour, gossip and waist-expanding dishes. Ruby Ann celebrates the summertime with a carload of delicious recipes, every one tried and tested by the obese connoisseur of cheap grub.",
nnbhmAEACAAJ,Rails cookbook,"9780596527310, 0596527314",514,2007,Paperback,O'Reilly,English,Rob Orsini,,2007,,"Computers / Languages / Ruby, Computers / Programming / General, Computers / Software Development & Engineering / General, Electronic books, Object-oriented programming (Computer science), Ruby (Computer program language), Ruby on rails (Electronic resource), Web site development, Web site development -- Handbooks, manualrs, etc, Ruby (Computer programming language)",,,,"Rails Cookbook is packed with the solutions you need to be a proficient developer with Rails, the leading framework for building the new generation of Web 2.0 applications. Recipes range from the basics, like installing Rails and setting up your development environment, to the latest techniques, such as developing RESTful web services.



With applications that are code light, feature-full and built to scale quickly, Rails has revolutionized web development. The Rails Cookbook addresses scores of real-world challenges; each one includes a tested solution, plus a discussion of how and why it works, so that you can adapt the techniques to similar situations. Topics include:
Modeling data with the ActiveRecord library Setting up views with ActionView and RHTML templ...",
pHpsUvO5tGoC,Anna Karenina,,837,2002,Paperback,Penguin Publishing Group,English,Leo Tolstoy,,1877,"Novel, Fiction, Literary realism, Drama, Historical romance","Fiction / Classics, Fiction / Historical / General, more",,,"Vronsky, Anna Karenina, Konstantin Dmitrievich Levin, Oblonsky, Aleksei Karenin, Kitty Shcherbatsky, Dolly, Sergius Ivanovich Koznyshev, Varenka, Knyagina Betsy, Countess Vronsky, Countess Lidia Ivanovna, Sergei Alexeyich Karenin, Nikolai Dmitrievich Levin","The must-have Pevear and Volokhonsky translation of one of the greatest Russian novels ever written

Described by William Faulkner as the best novel ever written and by Fyodor Dostoevsky as “flawless,” Anna Karenina tells of the doomed love affair between the sensuous and rebellious Anna and the dashing officer, Count Vronsky. Tragedy unfolds as Anna rejects her passionless marriage and thereby exposes herself to the hypocrisies of society. Set against a vast and richly textured canvas of nineteenth-century Russia, the novel's seven major characters create a dynamic imbalance, playing out the contrasts of city and country life and all the variations on love and family happiness.

While previous versions have softened the robust and sometimes shocking qualities of ...",(Penguin Classics Deluxe Edition)
kceNEAAAQBAJ,Anna Karenina,"9780451528612, 0451528611",942,"November 5, 2002",Paperback,Penguin Publishing Group,English,Leo Tolstoy,,1877,"Novel, Fiction, Literary realism, Drama, Historical romance","Fiction / Classics, Fiction / Literary, more",,,"Vronsky, Anna Karenina, Konstantin Dmitrievich Levin, Oblonsky, Aleksei Karenin, Kitty Shcherbatsky, Dolly, Sergius Ivanovich Koznyshev, Varenka, Knyagina Betsy, Countess Vronsky, Countess Lidia Ivanovna, Sergei Alexeyich Karenin, Nikolai Dmitrievich Levin","Tentang Penulis Lev Nikolayevich Tolstoy was a Russian writer who primarily wrote novels and short stories. Later in life, he also wrote plays and essays. His two most famous works, the novels War and Peace and Anna Karenina, are acknowledged as two of the greatest novels of all time and a pinnacle of realist fiction. Many consider Tolstoy to have been one of the world's greatest novelists. Tolstoy is equally known for his complicated and paradoxical persona and for his extreme moralistic and ascetic views, which he adopted after a moral crisis and spiritual awakening in the 1870s, after which he also became noted as a moral thinker and social reformer. Deskripsi Produk Anna Karenina startled the world with its powerful portrayal of the human need for love and purpose. In a story that b...",
14OMEAAAQBAJ,Anna Karenina,"9780140449174, 0140449175",837,2003,Paperback,Penguin UK,English,Leo Tolstoy,,1877,"Novel, Fiction, Literary realism, Drama, Historical romance","Fiction / Classics, Adultery -- Fiction -- Russia, more",,,"Vronsky, Anna Karenina, Konstantin Dmitrievich Levin, Oblonsky, Aleksei Karenin, Kitty Shcherbatsky, Dolly, Sergius Ivanovich Koznyshev, Varenka, Knyagina Betsy, Countess Vronsky, Countess Lidia Ivanovna, Sergei Alexeyich Karenin, Nikolai Dmitrievich Levin","Now the subject of a major new film adaptation from director Joe Wright (Atonement, Pride and Prejudice), Leo Tolstoy's Anna Karenina is translated by award-winning duo Richard Pevear and Larissa Volokhonsky in Penguin Classics.Starring Keira Knightley (A Dangerous Method) as Anna Karenina, Jude Law (Sherlock Holmes) as her husband Alexei, Aaron Johnson (Nowhere Boy) as Count Vronsky, and also starring Matthew McFadyen, Andrea Riseborough and Kelly Macdonald, this dazzling production of Anna Karenina is adapted for the screen by legendary playwright Tom Stoppard.Anna Karenina seems to have everything - beauty, wealth, popularity and an adored son. But she feels that her life is empty until the moment she encounters the impetuous officer Count Vronsky. Their subsequent affair scandalizes...",
Jv-m1SfwQzAC,CliffsNotes on Tolstoy's Anna Karenina,,80,"November 26, 1965",Paperback,Wiley,English,Marianne Sturman,,"November 26, 1965",,"Literary Criticism / Russian & Soviet, Adultery -- Drama, Feature films, Films for the hearing impaired, Karenina, Anna (Fictitious character) -- Drama, Married women -- Drama, Russia -- Drama",,,,"The original CliffsNotes study guides offer expert commentary on major themes, plots, characters, literary devices, and historical background.
CliffsNotes on Anna Karenina delves into the complex web of relationships in Tolstoy’s epic novel. As the characters unfold, this novel draws you into the lives of Karenin, Anna, and others as they struggle through the seemingly hopeless marriage patterns of urban society. Do romantic relationships make us stronger or weaker as individuals?
With insights into the characters of Anna Karenina, as well as information about Tolstoy’s own life and background, this study guide will help you get the most out of this classic novel. Other features that help you study include
A character list that reveals names, traits, and key relationshipsSu...",
zyXMwAEACAAJ,Anna Karenina,"9781593080273, 1593080271",803,2003,Paperback,Barnes & Noble Classics,English,graf Leo Tolstoy,,1877,"Novel, Fiction, Literary realism, Drama, Historical romance","Adultery -- Fiction, Fiction / Classics, more",,,"Vronsky, Anna Karenina, Konstantin Dmitrievich Levin, Oblonsky, Aleksei Karenin, Kitty Shcherbatsky, Dolly, Sergius Ivanovich Koznyshev, Varenka, Knyagina Betsy, Countess Vronsky, Countess Lidia Ivanovna, Sergei Alexeyich Karenin, Nikolai Dmitrievich Levin","Anna Karenina, by Leo Tolstoy, is part of the Barnes & Noble Classics series, which offers quality editions at affordable prices to the student and the general reader, including new scholarship, thoughtful design, and pages of carefully crafted extras. Here are some of the remarkable features of Barnes & Noble Classics New introductions commissioned from today's top writers and scholars Biographies of the authors Chronologies of contemporary historical, biographical, and cultural events Footnotes and endnotes Selective discussions of imitations, parodies, poems, books, plays, paintings, operas, statuary, and films inspired by the work Comments by other famous authors Study questions to challenge the reader's viewpoints and expectations Bibliographies for further reading Indices...",
6UsNAAAAQBAJ,Anna Karenina,"9780486437965, 0486437965",740,2004,Paperback,Dover Publications,English,"graf Leo Tolstoy, Louise Maude",,1877,"Novel, Fiction, Literary realism, Drama, Historical romance","Adultery -- Fiction, Fiction / Classics, Fiction / Literary, more",,,"Vronsky, Anna Karenina, Konstantin Dmitrievich Levin, Oblonsky, Aleksei Karenin, Kitty Shcherbatsky, Dolly, Sergius Ivanovich Koznyshev, Varenka, Knyagina Betsy, Countess Vronsky, Countess Lidia Ivanovna, Sergei Alexeyich Karenin, Nikolai Dmitrievich Levin","A beautiful society wife from St. Petersburg, determined to live life on her own terms, sacrifices everything to follow her conviction that love is stronger than duty. A socially inept but warmhearted landowner pursues his own visions instead of conforming to conventional views. The adulteress and the philosopher head the vibrant cast of characters in Anna Karenina, Tolstoy's tumultuous tale of passion and self-discovery.
This novel marks a turning point in the author's career, the juncture at which he turned from fiction toward faith. Set against a backdrop of the historic social changes that swept Russia during the late nineteenth century, it reflects Tolstoy's own personal and psychological transformation. Two worlds collide in the course of this epochal story: that of the old-...",
aV-kuQAACAAJ,Anna Karenina,"9781593081775, 1593081774",803,"August 26, 2004",Hardcover,"Barnes & Noble, Incorporated",English,Leo Tolstoy,,1877,"Novel, Fiction, Literary realism, Drama, Historical romance","Adultery -- Fiction, Married women -- Fiction, Russia -- Fiction -- Social life and customs -- 1533-1917",,,"Vronsky, Anna Karenina, Konstantin Dmitrievich Levin, Oblonsky, Aleksei Karenin, Kitty Shcherbatsky, Dolly, Sergius Ivanovich Koznyshev, Varenka, Knyagina Betsy, Countess Vronsky, Countess Lidia Ivanovna, Sergei Alexeyich Karenin, Nikolai Dmitrievich Levin","Anna Karenina, by Leo Tolstoy, is part of the Barnes & Noble Classicsseries, which offers quality editions at affordable prices to the student and the general reader, including new scholarship, thoughtful design, and pages of carefully crafted extras. Here are some of the remarkable features of Barnes & Noble Classics New introductions commissioned from today's top writers and scholars Biographies of the authors Chronologies of contemporary historical, biographical, and cultural events Footnotes and endnotes Selective discussions of imitations, parodies, poems, books, plays, paintings, operas, statuary, and films inspired by the work Comments by other famous authors Study questions to challenge the reader's viewpoints and expectations Bibliographies for further reading Indices &...",
tDDuAAAAMAAJ,Dinner with Anna Karenina,"9780778322276, 0778322270",360,2006,Hardcover,Mira,English,Gloria Goldreich,,2006,,"Book clubs (Discussion groups) -- Fiction, Divorce -- Fiction, Domestic fiction, Female friendship -- Fiction, Spouses -- Fiction, Books and reading -- Fiction, Female friendship -- Fiction -- New York (State) -- New York, Marital conflict -- Fiction, New York (N.Y.) -- Fiction",,,,"Six very different women, drawn together by their love of literature, get together each month to discuss their favourite novels, as well as to rally around each other when painful truths and dark betrayals are revealed, forcing them all to examine their own lives.",
eOrv5wGPnTgC,"Leo Tolstoy, Anna Karenina","9780521313254, 0521313252",114,"November 26, 1987",Paperback,Cambridge University Press,English,Anthony Thorlby,,,,"Literary Criticism / European / General, Literary Criticism / General, Authors, Russian -- Criticism and interpretation -- 19th century, Russian fiction",,,,Professor ThorIby offers a close reading of this classic novel and explores the subtle psychology in Tolstoy's characterisation. He avoids complex terminology and assumes a readership studying the text in English translation.,
OsenoMTnbyIC,Untouchable,"9780140183955, 0140183957",156,1986,Paperback,Penguin Books Limited,English,Mulk Anand,,1935,"Novel, Fiction","Fiction / Classics, Dalits -- Fiction, India, India -- Fiction, India -- Fiction -- Social life and customs, India -- Social life and customs -- Fiction, Caste -- Fiction -- India, Dalits, Espionage, Soviet -- Fiction, Fiction in English -- Indian writers -- Texts -- 1945, India -- Fiction -- Social conditions, Indian literature -- Fiction in English, Indic fiction (English), Large type books, Russians -- Fiction -- Great Britain, Teenagers -- Fiction",,,,"In Mulk Raj Anand's finest and most controversial novel he conveys precisely, with urgency and barely disguised fury, what it might feel like to be one of India's Untouchables. Bakha is a young man, a proud and even an attractive young man, but none the less he is an outcast in a system that is now only slowly changing and was then as cruel and debilitating as that of apartheid. Into this re-creation of one day in the life of Bakha, sweeper and latrine-cleaner, Anand poured a vitality, fire and richness of detail that have caused him to be acclaimed as his country's Charles Dickens as well as this century's greatest revealer of the 'other' India.
'It recalled to me very vividly the occasions I have walked 'the wrong way' in an Indian city and it is a way down which no novelist has yet taken me . . .' E.M. Forster
'One of the most eloquent and imaginative works to deal with this difficult and emotive subject' - Martin Seymour-Smith",
jj8obybCRasC,The Untouchable,"9780679767473, 0679767479",384,"June 30, 1998",Paperback,Knopf Doubleday Publishing Group,English,John Banville,,1997,"Novel, Thriller, Spy fiction","Fiction / Historical / General, Fiction / Literary, Fiction / War & Military, Espionage, Soviet -- Fiction -- History -- 20th century -- Great Britain, Gay men -- Fiction, Russians -- Fiction -- Great Britain, Spies -- Fiction -- Great Britain, Spy stories",,,,"WINNER OF THE LANNAN LITERARY AWARD FOR FICTION • From the Booker Prize-winning author of The Sea comes the fascinating story of a former British spy who's been unmasked as a Russian agent—and ""one of spy fiction's greatest characters"" (People). • ""Contemporary fiction gets no better than this."" —The New York Times Book Review

One of the most dazzling and adventurous writers now working in English takes on the enigma of the Cambridge spies in a novel of exquisite menace, biting social comedy, and vertiginous moral complexity. The narrator is the elderly Victor Maskell, formerly of British intelligence, for many years art expert to the Queen. Now he has been unmasked as a Russian agent and subjected to a disgrace that is almost a kind of death. But at whose i...",
BpobAQAAMAAJ,The Untouchables,"9781568491981, 1568491980",256,1957,Hardcover,Buccaneer,English,"Eliot Ness, Oscar Fraley",,1957,,"Crime -- Illinois -- Chicago, Criminals -- Illinois -- Chicago, Prohibition -- Illinois -- Chicago, Crime and criminals -- Illinois -- Chicago",,,,"The Untouchables is an autobiographical memoir by Eliot Ness co-written with Oscar Fraley, published in 1957.",
k9hfQgAACAAJ,Untouchables,"9780743270793, 0743270797",307,"October 11, 2005",Hardcover,Scribner,English,Narendra Jadhav,,"September 27, 2005","Biography, Autobiography","Biography & Autobiography / General, Biography & Autobiography / Historical, Social Science / Discrimination, Dalits -- Biography -- India -- Maharashtra -- Social conditions -- 20th century, Economists -- Biography -- India -- Maharashtra, Monetary reformers -- Biography -- India -- Maharashtra, Social Science / Social Classes & Economic Disparity",,,,"Every sixth human being in the world today is an Indian, and every sixth Indian is an untouchable. For thousands of years the untouchables, or Dalits, the people at the bottom of the Hindu caste system, have been treated as subhuman. Their story has rarely been told. This remarkable book achieves something altogether unprecedented: it gives voice to India's voiceless.
In Untouchables, Narendra Jadhav tells the awe-inspiring story of his family's struggle for equality and justice in India. While most Dalits had accepted their lowly position as fate, Jadhav's father rebelled against the oppressive caste system and fought against all odds to forge for his children a destiny that was never ordained.
Based on his father's diaries and family stories, Jadhav has written the triumph...",My Family's Triumphant Journey Out of the Caste System in Modern India
